{
  "algorithm": "MARS-CVaR",
  "bundle_evidence_hash": "5e3175050a229725f234f7795f0ba1996db0ee4911be7a8574367ad4cb276345",
  "bundle_sha256": "4ee28c764b4daaaa8f1c61406978f79caa22c4c5f0e3f6f44e65ab38d32f5485",
  "bundle_type": "AURUM_ENTERPRISE_EVIDENCE_BUNDLE",
  "claim_boundary": "Modeled optimization and historical walk-forward evidence only; not realized investment performance, a causal market forecast, a trade instruction, or a production promotion.",
  "decision_id": "MARS-812FA013EB90FFA1",
  "evidence": {
    "algorithm": "MARS-CVaR",
    "baselines": [
      {
        "cvar_loss_magnitude": 0.0,
        "cvar_loss_signed": -0.00382125,
        "expected_return": 0.0045738542,
        "name": "MARS-CVaR",
        "turnover": 0.36375,
        "weights": {
          "CASH": 0.2,
          "GLD": 0.381875,
          "SPY": 0.168125,
          "TLT": 0.25
        }
      },
      {
        "cvar_loss_magnitude": 0.0,
        "cvar_loss_signed": -0.00382125,
        "expected_return": 0.0045738542,
        "name": "static CVaR",
        "turnover": 0.36375,
        "weights": {
          "CASH": 0.2,
          "GLD": 0.381875,
          "SPY": 0.168125,
          "TLT": 0.25
        }
      },
      {
        "cvar_loss_magnitude": 0.01045,
        "cvar_loss_signed": 0.01045,
        "expected_return": -0.000325,
        "name": "equal weight",
        "turnover": 0.2,
        "weights": {
          "CASH": 0.25,
          "GLD": 0.25,
          "SPY": 0.25,
          "TLT": 0.25
        }
      },
      {
        "cvar_loss_magnitude": 0.0,
        "cvar_loss_signed": -0.00212,
        "expected_return": 0.01432,
        "name": "mean variance",
        "turnover": 0.9,
        "weights": {
          "CASH": 0.1,
          "GLD": 0.6,
          "SPY": 0.0,
          "TLT": 0.3
        }
      }
    ],
    "claim_boundary": "Modeled optimization and historical walk-forward evidence only; not realized investment performance, a causal market forecast, a trade instruction, or a production promotion.",
    "constraints": [
      {
        "limit": 1.0,
        "name": "portfolio sum",
        "observed": 1.0,
        "slack": 0.0,
        "status": "PASS"
      },
      {
        "limit": 0.1,
        "name": "minimum cash",
        "observed": 0.2,
        "slack": 0.1,
        "status": "PASS"
      },
      {
        "limit": 0.03,
        "name": "CVaR gate signed loss",
        "observed": -0.00382125,
        "slack": 0.03382125,
        "status": "PASS"
      },
      {
        "limit": 0.4,
        "name": "turnover gate",
        "observed": 0.36375,
        "slack": 0.03625,
        "status": "PASS"
      },
      {
        "limit": 0.6,
        "name": "position cap SPY",
        "observed": 0.168125,
        "slack": 0.431875,
        "status": "PASS"
      },
      {
        "limit": 0.6,
        "name": "position cap TLT",
        "observed": 0.25,
        "slack": 0.35,
        "status": "PASS"
      },
      {
        "limit": 0.6,
        "name": "position cap GLD",
        "observed": 0.381875,
        "slack": 0.218125,
        "status": "PASS"
      },
      {
        "limit": 1.0,
        "name": "position cap CASH",
        "observed": 0.2,
        "slack": 0.8,
        "status": "PASS"
      }
    ],
    "data_provenance": {
      "adjustment_method": "not applicable to deterministic reference scenarios",
      "decision_data_class": "BUNDLED_REFERENCE_DATA",
      "frequency": "reference scenario period; walk-forward artifact retains its own historical frequency",
      "missing_data_policy": "not applicable to deterministic reference scenarios; live mode must fail explicitly rather than silently fall back",
      "provider": "repository deterministic fixture",
      "scenario_data_class": "SIMULATED_RESAMPLED_SCENARIOS",
      "source_artifacts": [
        "data/digital_twin/historical_prices/*.csv",
        "artifacts/mars_cvar/walk_forward_evidence.json"
      ],
      "walk_forward_data_class": "HISTORICAL_OBSERVATIONAL_DATA"
    },
    "decision": {
      "algorithm": "MARS-CVaR",
      "assets": [
        "SPY",
        "TLT",
        "GLD",
        "CASH"
      ],
      "authorized": true,
      "blocked_reasons": [],
      "claim_boundary": "Optimization evidence only; not a forecast of realized investment performance.",
      "current_weights": {
        "CASH": 0.2,
        "GLD": 0.2,
        "SPY": 0.35,
        "TLT": 0.25
      },
      "cvar_loss": -0.00382125,
      "cvar_loss_convention": "signed loss = negative portfolio return; negative values indicate the modeled tail return is positive",
      "decision_authorization_state": "AUTHORIZED",
      "decision_id": "MARS-812FA013EB90FFA1",
      "expected_return": 0.004573854166666668,
      "feasibility": {
        "max_position_cap_violation": 0.0,
        "minimum_cash_slack": 0.1,
        "portfolio_sum_residual": 0.0,
        "status": "FEASIBLE"
      },
      "gates": {
        "cvar": {
          "limit": 0.03,
          "observed": -0.00382125,
          "passed": true
        },
        "turnover": {
          "limit": 0.4,
          "observed": 0.36375,
          "passed": true
        }
      },
      "objective": 0.012276208333333333,
      "objective_decomposition": {
        "cvar_convention": "signed loss = negative portfolio return; a negative CVaR means the modeled tail return is positive, not that the loss display is missing a minus sign",
        "expected_return_component": -0.0045738542,
        "objective_reconstructed": 0.0122762083,
        "tail_risk_component_signed": -0.0013374375,
        "turnover_component": 0.0181875
      },
      "parameters": {
        "alpha": 0.95,
        "cash_asset": "CASH",
        "max_cvar_loss_gate": 0.03,
        "max_turnover_gate": 0.4,
        "max_weights": [
          0.6,
          0.6,
          0.6,
          1.0
        ],
        "min_cash": 0.1,
        "risk_aversion_lambda": 0.35,
        "turnover_penalty_tau": 0.05
      },
      "regime_probabilities": {
        "calm": 0.5,
        "stress": 0.5
      },
      "research_promotion_state": "RESEARCH_ONLY",
      "risk_gate": "AUTHORIZED",
      "scenario_count": 6,
      "solver": {
        "backend": "scipy.optimize.linprog",
        "method": "highs",
        "objective": 0.012276208333333333,
        "status": "OPTIMAL"
      },
      "status": "OPTIMAL",
      "target_weights": {
        "CASH": 0.2,
        "GLD": 0.381875,
        "SPY": 0.168125,
        "TLT": 0.25
      },
      "turnover": 0.36375,
      "weight_changes": {
        "CASH": 0.0,
        "GLD": 0.181875,
        "SPY": -0.181875,
        "TLT": 0.0
      }
    },
    "frontier": [
      {
        "cvar_loss_signed": 0.02346,
        "expected_return": -0.0043683333,
        "objective": 0.0067143333,
        "risk_weight_lambda": 0.1,
        "turnover": 0.0
      },
      {
        "cvar_loss_signed": -0.00382125,
        "expected_return": 0.0045738542,
        "objective": 0.0122762083,
        "risk_weight_lambda": 0.35,
        "turnover": 0.36375
      },
      {
        "cvar_loss_signed": -0.00382125,
        "expected_return": 0.0045738542,
        "objective": 0.0107477083,
        "risk_weight_lambda": 0.75,
        "turnover": 0.36375
      },
      {
        "cvar_loss_signed": -0.00382125,
        "expected_return": 0.0045738542,
        "objective": 0.0078817708,
        "risk_weight_lambda": 1.5,
        "turnover": 0.36375
      },
      {
        "cvar_loss_signed": -0.00382125,
        "expected_return": 0.0045738542,
        "objective": 0.0021498958,
        "risk_weight_lambda": 3.0,
        "turnover": 0.36375
      }
    ],
    "governance": {
      "execution_enabled": false,
      "human_review_required": true,
      "optimization_authorization": "AUTHORIZED",
      "research_promotion": "RESEARCH_ONLY",
      "separation_note": "Optimization authorization says the analytical inputs passed their execution gate; research promotion remains a separate empirical question."
    },
    "market_regime": {
      "current_regime": "stress",
      "decision_input_next_regime_probabilities": {
        "calm": 0.5,
        "stress": 0.5
      },
      "estimated_next_regime_probabilities": {
        "calm": 0.5,
        "stress": 0.5
      },
      "historical_regime_frequencies": {
        "calm": 0.5454545455,
        "stress": 0.4545454545
      },
      "limitations": [
        "Reference states and probabilities are deterministic evidence fixtures.",
        "A Markov regime model is descriptive state-transition evidence, not causal proof of markets.",
        "Live data acquisition is optional and is not used by the offline product acceptance path."
      ],
      "probability_entropy_normalized": 1.0,
      "probability_vector_source": "operator-controlled reference/counterfactual input; not a causal market forecast",
      "regime_persistence": {
        "calm": 0.5,
        "stress": 0.5
      },
      "state_definitions": {
        "calm": "lower reference volatility state",
        "stress": "higher reference volatility state"
      },
      "transition_matrix": {
        "calm": {
          "calm": 0.5,
          "stress": 0.5
        },
        "stress": {
          "calm": 0.5,
          "stress": 0.5
        }
      },
      "transition_matrix_row_sums": {
        "calm": 1.0,
        "stress": 1.0
      },
      "transition_matrix_valid": true
    },
    "portfolio_workspace": {
      "asset_contributions": [
        {
          "asset": "SPY",
          "expected_return_contribution": -0.0052959375,
          "expected_return_per_unit": -0.0315,
          "weight": 0.168125
        },
        {
          "asset": "TLT",
          "expected_return_contribution": 0.0030833333,
          "expected_return_per_unit": 0.0123333333,
          "weight": 0.25
        },
        {
          "asset": "GLD",
          "expected_return_contribution": 0.0067464583,